<?xml version="1.0"?>
<level xmlns="http://bfh.ch"
       xmlns:xsi="http://www.w3.org/2001/XMLSchema-instance"
       xsi:schemaLocation="http://bfh.ch level1.xsd">
    <row id="0">
        <column id="0" type="EMPTY"/>
        <column id="1" type="EMPTY"/>
        <column id="2" type="EMPTY"/>
        <column id="3" type="EMPTY"/>
    </row>
    <row id="1">
        <column id="0" type="WALL"/>
        <column id="1" type="WALL"/>
        <column id="2" type="EMPTY"/>
        <column id="3" type="WALL"/>
    </row>
    <row id="2">
        <column id="0" type="WALL"/>
        <column id="1" type="EMPTY"/>
        <column id="2" type="EMPTY"/>
        <column id="3" type="EMPTY"/>
    </row>
    <row id="3">
        <column id="0" type="WALL"/>
        <column id="1" type="EMPTY"/>
        <column id="2" type="EMPTY"/>
        <column id="3" type="WALL"/>
    </row>
    <row id="4">
        <column id="0" type="WALL"/>
        <column id="1" type="EMPTY"/>
        <column id="2" type="EMPTY"/>
        <column id="3" type="WALL"/>
    </row>
    <name>crazy level 9999</name>
    <startPosition row="2" column="2"/>
</level>